,Movie Title,Plot Summary,Cover Image,Year,Source
54,The Gunman (2015 film),"American Jim Terrier is a former Special Forces soldier who has become a black-ops mercenary. He is part of a team deployed by a corporation in the Democratic Republic of Congo in 2006, under the cover of providing security to local projects. He falls in love with Annie, a fellow expat working as an NGO doctor in a local hospital. During this period, even though civil war has wreaked havoc on the country, large multinational mining companies continue to profit from the country's mining industry. After the Minister of Mining announces his plans to declare contracts with the mining companies unjust and renegotiate the terms, the mining companies hire Terrier's team to assassinate the Minister to ensure their access to the rich mineral resources. Terrier delivers the fatal shot from a sniper rifle and flees from Africa, leaving Annie behind. After that, Terrier retires from his mercenary career.
Eight years later he returns to DRC as a charity worker to build wells. One day Terrier is brutally assaulted by a local hit squad, but he manages to kill them all. While searching the attackers' bodies, he finds signs that the attack was not random and that he was the target. Scared and suspicious, Terrier flees to London to meet an ex-mercenary colleague Cox, who reveals that Felix Marti, their ex-boss in the Congo assassination, has formed a large international security firm offering its services to major clients, such as the Pentagon. The firm's head wants to eliminate all of the former members of the assassination squad as revelations of their former activities could hinder the development of the new firm. Now the firm's hit teams chase Terrier around the clock, meanwhile killing his friends and kidnapping Annie.
However, Terrier still keeps highly compromising materials that can reveal Cox's role in the Congo assassination and uses it to lure Cox and his team to a bullfight in Spain, threatening to expose their complicity unless they trade Annie for the evidence. Unknown to them, Terrier makes a deal with Interpol to provide evidence to aid their ongoing investigation. Despite battling severe head trauma suffered from his violent past, Terrier defeats the experienced mercenaries sent to kill him. As he struggles to help Annie escape to safety, Cox discovers them. Terrier is wounded but manages to shoot Cox, who is then gored by a loose bull. Interpol officers arrive and take Terrier into custody, though Agent Barnes promises to do what he can to help Terrier avoid doing more jail time than necessary.
The film ends with Terrier, recovered and released from prison, reuniting with Annie in the DRC.
",upload.wikimedia.org/wikipedia/en/thumb/c/c7/The_Gunman_Official_Theatrical_Poster.jpg/220px-The_Gunman_Official_Theatrical_Poster.jpg,2015,https://en.wikipedia.org//wiki/The_Gunman_(2015_film)
55,Tracers (film),"Cam is an NYC bike messenger who rents a garage from a woman named Angie and also struggling to make ends meet. While on a run, Cam wrecks his bike after a stranger named Nikki causes an accident while escaping from police officers. Cam is later accosted by two enforcers Jerry and Hu, who take his check and cash, warning him that he is behind on payments for a $15,000 loan to the Tong, a local gang that controls Chinatown, and warn him not to miss another payment. Cam spends his free time trying to fix his father's 1967 Pontiac GTO. Cam's boss calls and tells him that his ""girlfriend"" has dropped off his new bike. Cam finds Nikki to thank her and tries to copy Nikki's parkour, but to no avail. Cam also meets Nikki's group, who warn him about the dangers of parkour.
Cam begins practicing parkour and eventually catches the attention of the group, where he is invited to train with them. Cam is formally introduced to the rest of the squad: Jax, Tate, Nikki's older brother Dylan, and Miller, the group's leader. After a workout, Cam arrives home to find Jerry and Hu taking his father's car, taking off $5,000 dollars off his debt for it. They warn him he has one month to pay the rest of the $10,000, threatening Angie and her son. Angered, Angie packs Cam's belongings and kicks him out. Cam joins the group for work. Miller tells Cam that he must follow two rules: if Cam gets into trouble, he must call him immediately and he must stay out of Chinatown. Cam quickly becomes a valuable member of the team. He visits Angie at work and explains that he took the loan from the Tongs to help his sick mother keep her house, but that the money wasn't enough to stop foreclosure and his mother died a week after.
Cam runs into Jerry and Hu, who beat him for not having the money and give him two weeks to pay off his debt or they will kill Angie and Joey. Cam makes a move on Nikki at a party. Nikki initially reciprocates, but then runs out of the party. Miller arrives to pick her up as she is Miller's partner. Nikki apologizes to Cam for not being honest. Cam invites Nikki to leave the city with him once he clears his debt, but Nikki is hesitant. For their biggest heist yet, the group tries to rob a bank which is run by Vietnamese gangsters. They discover that the money had been moved earlier and flee as reinforcements arrive. Jax is shot and killed, while Cam is arrested. Miller visits Cam while the police question him. Miller reveals himself to be James Hatcher, a corrupt DEA agent. Miller tells Cam that he can free him by claiming him as a confidential informant for the DEA in exchange for helping him pull off one last heist.
Cam reluctantly agrees and confronts Nikki for not telling him about Miller's true identity. Nikki apologizes and reveals she is indebted to Miller for helping Dylan escape custody for beating a man who had sexually assaulted her. On the day of the heist, Miller, Cam, and Dylan go to a Russian safehouse to steal a stash of diamonds. Nikki realizes Cam is being set up and tries to save him. Miller steals the diamonds and almost kills Cam, but is stopped as guards arrive and attack them. Cam takes the diamonds and flees, where Miller chases him. After reuniting with Nikki, Cam leads Miller into a restaurant owned by Chen, who is the leader of the Tongs. Chen reminds Miller that he has violated his agreement to never enter Chinatown and has him board a ship headed for Macau, never to return. Cam hands the diamonds to Chen, thus clearing his debt. Jerry congratulates Cam for clearing his debt and returns his father's fully restored car, which Cam and Nikki drive off.
",upload.wikimedia.org/wikipedia/en/thumb/0/09/Tracers_MoviePoster.jpg/220px-Tracers_MoviePoster.jpg,2015,https://en.wikipedia.org//wiki/Tracers_(film)
56,The Walking Deceased,"A zombie outbreak is caused by a sushi chef not washing his hands before preparing a meal, gloveless, for homeless dumpster-divers.
29 days later in a hospital, a zombie named Romeo thinks to himself how zombies are slowly regaining humanity. He evades survivors Chicago (who is looking for porn) and Green Bay, who meets idiotic Sheriff Lincoln (Dave Sheridan), who has woken from a coma; his son Chris accidentally hits him with a baseball, making him misremember Chris' name. After learning LinkedIn is what's left of the internet, Lincoln decides to search for his family; Green Bay and Chicago wish him luck, revealing their group resides in the mall. Lincoln mistakes a child and her father for ""clever zombies"", killing them and taking their van. Romeo notices an attractive girl named Brooklyn with Green Bay and Chicago, deciding to follow her. Green Bay likes Brooklyn as well, but is too stupid to realize she hates him. Elsewhere, Super Survivor is taking out zombies.
Lincoln investigates his home, finding a note from his son; they've taken shelter at his wife's workplace, a strip club. He finds Chris continued running the establishment (but is now foul mouthed). Due to stupid patrons (a parody of Shaun and Ed), a zombie bites Lincoln's wife Barbie, whom Chris kills. They head to the mall, meeting other survivors: Harlem (Brooklyn's sister, whose thoughts appear as texts) and Darnell (who thinks his toy crossbow is real, and talks about rumors). Romeo arrives as well, followed by other zombies; he saves Brooklyn, who finds him attractive, while Darnell takes out the zombies. The group reorganizes, with Lincoln and Chicago both declaring themselves leader of the ""di-archy""; they order the group to pack up to head to ""the farm"", a haven free of zombies.
They find the ""Safe Haven"" farm, owned by the elderly Reganites, whom the group thinks is hiding their daughter Isaac because she's a zombie. They later meet Isaac, finding her uninfected; because her parents don't have any way to keep track of the outside world, they don't know about the infection. She keeps it secret, thinking her partially-senile parents would have heartattacks.
Isaac, Green Bay, Brooklyn, Chicago and Romeo get high on weed the next day, setting off fireworks that attract zombies. After Chris kills a zombie, Lincoln explains to the couple about the outbreak; however, this goes over their heads as they pay more attention to the drug use than the zombies, who they think are stoners. Harlem snaps at Darnell and Green Bay, revealing she is deaf and can read lips. Green Bay and Isaac take out zombies that make it to the house, using weapons and ""mind-blowing"" facts. Out in the field, Darnell accidentally kills the Super Survivor, who followed the fireworks, with a gun. Anguished, Darnell ends up pinned by a zombie; Harlem shoots him in the head, sick of his idiocy.
Brooklyn has Romeo bite her so they can be together, only to learn minutes later that a cure has been put in the water supply; she and Romeo spray water into their bite marks, curing them. Romeo admits that he finds Brooklyn attractive but bitchy. Using super soakers and the garden hose, the group spray the zombies with the cure; however, Lincoln still shoots live rounds at them until Chicago stops him.
Later, the survivors and the cured have a party, where Chris finally kisses a happy Harlem; Chris also reverts to being kind. Romeo and Brooklyn make out, while Chicago has sex with a cured woman. Green Bay and Isaac head to her room for sex, only to hear the radio announce a meteor the size of Texas is heading to Earth.
",upload.wikimedia.org/wikipedia/en/thumb/4/4c/The_Walking_Deceased_film_poster.jpg/220px-The_Walking_Deceased_film_poster.jpg,2015,https://en.wikipedia.org//wiki/The_Walking_Deceased
57,Get Hard,"James King is a wealthy hedge fund manager at Barrow Funds, engaged to Alissa, the daughter of his boss Martin Barrow. During an engagement party for James and Alissa, the FBI arrive and arrest James for fraud and embezzlement. James' lawyer, Peter Penny, urges him to plead guilty for a likely shorter sentence, but James refuses under the belief that he will be exonerated. James is found guilty, however, and subsequently sentenced to 10 years in San Quentin State Prison, with the judge allowing him 30 days to get his affairs in order. On top of this, Alissa leaves James after he suggests the two flee the country together.
Over time, James has come to know Darnell Lewis, who operates a small car wash business in the parking lot used by James. Shortly after his arrest, James encounters Darnell and, assuming he has been incarcerated before because he is Black, begs him for help, requesting to be ""toughened up"". Darnell, who in actuality has never been to prison and has little experience in fighting, agrees, on the condition James pays him $30,000; Darnell sees it as an opportunity for him and his wife Rita to finally put their daughter Makayla in a better school, away from the bad neighborhood they live in.
Darnell's training, which includes pepper-spraying James, re-modelling his house to resemble a maximum security prison and creating multiple scenarios in which he must defend himself, all fail miserably. During the training, James gets in touch with Martin to tell him about his search for help. Martin, the actual crook, believes James is onto him and orders a hitman named Gayle to monitor him.
With James' training seemingly going nowhere, Darnell suggests that James should prepare in other ways for prison, and takes him to a gay hookup spot to teach James how to perform oral sex in prison. James can't go through with it and instead tells Darnell that he will keep going and do whatever it takes in order to ""get hard"". James soon after begins to work out harder and faster, makes shivs, learns ""keistering"" (smuggling contraband in the anus), and seems to be making progress. Darnell simulates a prison riot with help from James' domestic staff. In the chaos, James gets a shiv stuck in his head, after which, Darnell brings James to his home for Rita to treat it. James has dinner with Darnell's family and listens to the tale of how he ended up in prison, which is actually just a retelling of the movie Boyz n the Hood.
James and Darnell resolve for James to join a local gang called the Crenshaw Kings to gain protection in prison. However, Darnell's cousin and gang leader Russell rebuffs James and redirects him to the Alliance of Whites gang. James is unable to portray a convincing racist, leading the gang to think he is a cop; they threaten to attack James, but Darnell rescues him by bursting in with a flamethrower.
Eventually, Darnell and James finally deduce that Martin is the crook, and the reason James is going to prison. They sneak into his office and find the embezzlement records on Martin's computer. Before they can expose him, Gayle finds them and takes back the computer, informing James that Darnell is not who he thinks he is and has never been in prison. Dejected and upset that Darnell lied to him, James returns to the Crenshaw Kings on his own, asking to join. They accept him as one of their own and order him to kill someone as his initiation. Before he can do so, Darnell arrives in time to convince James to expose Martin.
The two sneak onto Martin's yacht to retrieve the computer, only to come across Gayle and his men. James unleashes a series of capoeira moves on them before Martin and Alissa arrive, both confessing to the fraud and embezzlement, a scheme that also included Peter. They try to convince James to run away with them, but he turns them down and heads to a life raft with Darnell. When Gayle shoots the life raft, James pulls out a gun he had ""keistered"" and aims it at Gayle. U.S. Marshals suddenly appear, summoned by the ankle monitor that James triggered, having trespassed the county line.
Barrow's computer provides the evidence needed to clear James. Martin, Gayle, Alissa, and the henchmen are all arrested and James is exonerated. However, he still ends up getting six months for holding an unlicensed gun, but thanks to Darnell's training, James is fully prepared for his stint in prison, unlike Martin, who is quickly attacked by inmates when his San Quentin sentence with Peter begins. James spends his sentence helping the FBI retrieve all the assets that Martin stole, while guiding Darnell's investments so that he and Rita are able to open their own carwash. As Darnell drives James home after his release, James announces his intent to celebrate his freedom with a Wall Street Journal and a forty, which he now considers a perfect Sunday.
",upload.wikimedia.org/wikipedia/en/thumb/3/38/Get_Hard_film_poster.png/220px-Get_Hard_film_poster.png,2015,https://en.wikipedia.org//wiki/Get_Hard
58,Home (2015 film),"A cowardly alien race known as the Boov, led by Captain Smek, commence their ""friendly"" invasion of the planet Earth. Relocating the humans, whom the Boov deem as simple and backwards, to the Australian Outback, the Boov inhabit their homes. Oh, an accident-prone, free-thinking Boov, decides to invite the other Boov to his apartment for a housewarming party, but no one comes. Meanwhile, 13-year-old[6] Gratuity ""Tip"" Tucci and her Japanese Bobtail cat Pig, who managed to avoid being taken during the invasion, drive around the city searching for Tip's mom Lucy.
Oh visits grumpy Boov traffic officer Kyle, to invite him to the party. However, Oh accidentally sends the invitation email to every alien race in the galaxy, including the hostile Gorg, who have been the Boov's longtime enemy ever since a failed peace meeting, during which Captain Smek stole an artifact he later dubbed ""the Shusher"". Furious with Oh for revealing their new home to the Gorg, the Boov declare him a fugitive. Oh runs into a convenience store to hide, just as Tip crashes the car and enters the store in search of supplies. Tip attacks Oh on sight, and locks him in a freezer, until he promises to fix her car, which he turns into a flying craft named ""Slushious"".
To hide from the Boov, Oh promises to help Tip find Lucy. However, Oh secretly plans to abandon Tip and take himself to Antarctica, the only place on Earth with no Boov. His attempt to leave Tip in a public restroom is thwarted by Kyle, who arrives to force Oh to give him his email password so Smek can cancel the invitation.
Escaping Kyle, Oh and Tip reach Paris and sneak into the Boov Command Centre. Oh cancels the invitation before it reaches the Gorg; he then looks for Lucy, and the computer confirms she is in Australia. Trying to return to Slushious, Oh and Tip are cornered by Smek and many other Boov at the Great Antenna (Eiffel Tower). Smek orders Oh's execution, despite the invitation being stopped. Tip uses a Boov gravity device to turn the tower upside down, and she and Oh escape.
Oh informs Tip that he no longer believes Smek's propaganda about humans being simple and backward, and apologizes to her. They fly to Australia, but are suddenly surrounded by hundreds of Boov fleeing from Gorg drones, sent to search for them. Slushious is wrecked, but Oh finds a Gorg SuperChip in a crashed drone, and uses it to repair the car.
When they reach the human relocation camp, Oh realizes the other Boov are evacuating, and fears that the Gorg will take vengeance on Earth when they cannot find the Boov. He tries to convince Tip to flee with them, but she refuses. Oh joins the Boov, but runs back towards the Gorg to use the SuperChip to power the Boov mothership, which then easily outpaces the Gorg. Impressed at his bravery, the other Boov listen as Oh berates Captain Smek for his lies, and the other Boov for their cowardice. Moved, Kyle takes the Shusher from a horrified Smek and decrees that Oh should be the new captain. Oh reluctantly accepts, turns the ship around, and returns to Earth. He helps Tip reunite with Lucy, fulfilling his promise.
Realizing from a chance remark of Tip's that the Gorg are actually tracking the Shusher and not the Boov, Oh locks Tip and Lucy inside Slushious, and faces the approaching Gorg ship alone. Tip and Lucy escape and try to stop him. The Gorg ship hits the brakes, only just avoiding crushing Oh. He returns the Shusher, revealed to be an egg containing the entire next generation of Gorg. The lone Gorg inside the ship happily accepts the egg; being the last of his kind, he had been desperately searching for his children.
Two weeks later, the Boov have relocated their colony to the Moon. Many Boov visit Earth, which has been returned to normal, and mingle with the humans, who are restored to their original homes. Oh moves in with the Tuccis; many other aliens, invited by Oh, come to visit Earth and attend his parties.
",upload.wikimedia.org/wikipedia/en/8/85/Home_%282015_film%29_poster.jpg,2015,https://en.wikipedia.org//wiki/Home_(2015_film)
59,Serena (2014 film),"In Depression-era North Carolina, George Pemberton is an ambitious timber baron who falls in love with Serena Shaw, a young woman with a sad past. They marry, and she joins him on his land and starts to take control, pressuring and questioning George while remaining affectionate.
George's business partner Buchanan feels threatened as Serena begins to undermine his authority. The partnership worsens, and Buchanan strikes a deal with the local sheriff, who wants to buy George's land to make a park. George is hurt by his betrayal, and Serena convinces him Buchanan was never his friend.
On a shooting trip, George and Buchanan go alone to flush out a bear. George contemplates killing him, only to hesitate and be seen by him. Buchanan cocks his rifle, but George fires first and kills him. Campbell, George's worker, witnesses the murder but denies it to Sheriff McDowell, and the death is ruled an accident. Serena consoles George and justifies his actions.
After seeing his illegitimate son Jacob posing with his mother, Rachel, for a picture, George feels responsible for the boy and begins giving her money. Serena remains unaware of this, but considers Rachel and the baby a threat.
When Galloway loses his hand to an errant axe swing, Serena uses a belt as a tourniquet to save his life. George rushes the pregnant Serena to the hospital after she experiences heavy bleeding and pain. She miscarries, and they learn she can never again bear children. Tensions grow, and the parentage of Rachel's baby becomes more obvious to Serena.
While Serena and George are away, Campbell takes ledgers from the safe and presents them to the Sheriff. He is preparing to testify that George has been bribing a senator and shot Buchanan deliberately. Discovering what Campbell has done, George and Serena realize he could ruin them.
Galloway tells Serena that he knows where Campbell is, and tells George there is a panther in the forest so he's busy hunting it. Meanwhile, Galloway heads into town to kill Campbell and retrieve the ledgers. Finding George’s hidden picture of Rachel and her baby and discovering that George has been giving Rachel money, Serena scratches the baby's face from the photograph.
Serena leaves with Galloway, telling George that she has business to take care of. Not finding Rachel at home, they head for the Widow Jenkins’. George's employee Vaughn calls the Sheriff, worried about Rachel and what Serena plans to do. The Sheriff goes to Widow Jenkins', finding her with her throat slashed, and takes Rachel and her baby away.
In the morning, the Sheriff questions George, revealing that Galloway killed Campbell and the Widow Jenkins and that he is after Rachel and her child. George asks Serena if she sent him to kill Rachel and Jacob, which she insists was necessary. He storms out; when Serena follows him, he briefly chokes her before driving off with a gun and the ledgers.
George goes to the Sheriff, gives him the ledgers, and promises to turn himself in if he tells him where Rachel and the baby are. George races to save her before Galloway finds her. Galloway tracks Rachel to the train station, where she hides in a shed. As the train approaches, George finds Galloway, who sees Rachel jump onto the train. George goes after them and slashes Galloway's throat.
George bids Rachel and the baby farewell as they depart to live with Vaughn. George returns to the camp and sets off to hunt the panther. He shoots it, but it leaps at him from behind, fatally wounding him. He manages to kill it with a hunting knife before dying.
The Sheriff returns to the Pemberton cabin with George's body. Serena, having expected him to return, grows upset and refuses to identify his body. As the Sheriff leaves, she lies on the bed and uses a lighter to set the cabin on fire. Serena remains motionless as it burns, killing her.
",upload.wikimedia.org/wikipedia/en/thumb/8/8f/Serenaposter.jpg/220px-Serenaposter.jpg,2015,https://en.wikipedia.org//wiki/Serena_(2014_film)
