,Movie Title,Plot Summary,Cover Image,Year,Source
102,Inside Out (2015 film),"In the mind of a young girl named Riley are a series of personified basic emotions that control her actions: Joy, Sadness, Fear, Disgust, and Anger. Riley's experiences become memories that are stored as colored orbs and are sent into long-term memory each night. The aspects of five most-important ""core memories"" within her personality take the form of five floating islands. Joy acts as the leader; she tries to limit Sadness's influence. Joy sees purpose in Fear, Disgust, and Anger but thinks Sadness worsens everything.
At the age of 11, Riley moves from Minnesota to San Francisco for her father's new job. At first, she has poor experiences; the new house is cramped and old, her father hardly has any time for Riley, a local pizza parlor only serves pizza topped with broccoli, which she dislikes, and the moving van with their belongings was misdirected to Texas and will not arrive for weeks. On Riley's first day at her new school, Sadness retroactively saddens joyous memories, causing Riley to cry in front of her class and creates a sad core memory. Joy tries to dispose of this memory using a pneumatic tube but accidentally knocks loose the other core memories during a struggle with Sadness, disabling the personality islands. Joy, Sadness, and the core memories are sucked out of Headquarters.
In the absence of Joy and Sadness, Anger, Fear, and Disgust are forced to take control of Riley; they try to make happy core memories but the results are disastrous, distancing Riley from her parents, peers, and hobbies. Without the core memories, Riley's personality islands gradually crumble and fall into the ""Memory Dump"", where things fade to non-existence as they are forgotten. Anger, intending to restore Riley's happiness, resolves to run away to Minnesota.
While navigating the vast long-term memory area, Joy and Sadness encounter Bing Bong, Riley's imaginary friend, who suggests riding the ""train of thought"" back to Headquarters. After several adventures and mishaps, the trio catch the train but it halts when Riley falls asleep then entirely derails when another island collapses. Joy, who is afraid all of the core memories will become sad, abandons Sadness and tries to ride a ""recall tube"" back to Headquarters. The ground below the tube collapses, breaking it and plunging Joy and Bing Bong into the Memory Dump.
After discovering a sad memory that turned happy when Riley's parents and friends comforted her, Joy understands Sadness's purpose in alerting others when Riley is emotionally overwhelmed and needs help. Joy and Bing Bong try to use Bing Bong's song-fueled wagon rocket to escape the Memory Dump. They fail to fully ascend due to their combined weight until Bing Bong jumps out at the last moment and fades away.
Joy reunites with Sadness and they return to Headquarters, discovering Anger's idea has disabled the console, putting Riley into depression as she boards a bus to Minnesota. To the surprise of the others, Joy hands control of the console to Sadness, who is able to reactivate it and prompt Riley to return to her parents. As Sadness re-installs the core memories, transforming them from happy to sad, Riley tearfully tells her parents she misses her old life. Riley's parents comfort her and tell her they also miss Minnesota. Joy and Sadness work the console together, creating a new core memory consisting of happiness and sadness, and new island forms, representing Riley's acceptance of her new life in San Francisco.
A year later, Riley, who is now aged 12, has adapted to her new home, made new friends, and returned to her old hobbies and has acquired new ones. Inside Headquarters, Riley's emotions admire her new personality islands and are given a newly expanded console with enough room for them to work together.
",upload.wikimedia.org/wikipedia/en/0/0a/Inside_Out_%282015_film%29_poster.jpg,2015,https://en.wikipedia.org//wiki/Inside_Out_(2015_film)
103,Max (2015 film),"Max, a Belgian Malinois military dog[4] used to help U.S. Marines in Afghanistan, is handled by Kyle Wincott (Robbie Amell) (Marine MWD). Kyle is questioned when weapons seized by his squad go missing. Realizing his friend Tyler Harne (Luke Kleintank) is among those involved with the shady dealings, he warns Tyler that he cannot cover for him. The two then go into the battlefield with their squad, with Max on point. While advancing on a suicide bomber, Max is injured by an explosion. In the ensuing gunfight, Kyle is shot and killed.
Kyle's brother Justin (Josh Wiggins), who makes money selling illegally copied video games, their mother Pamela (Lauren Graham) and their father Ray (Thomas Haden Church) are informed of his death. After Kyle's body is brought home for burial, the other Marines notice that Max is only calm when he is around Justin, apparently sensing that he is Kyle's brother. The family adopts the dog, who would otherwise be euthanized for his disturbed behavior. Justin initially wants little to do with Max but eventually warms up to him. While meeting up with his friend Chuy (Dejon LaQuake), Justin meets Chuy's cousin Carmen (Mia Xitlali), who offers to go to his house and show him some handling tricks for Max. Little by little, Max's behavior improves around other people.
Tyler visits the Wincotts one evening, provoking an aggressive response by Max. Later, after the Fourth of July, Ray asks Tyler what really happened. Tyler implies that Max turned on Kyle and caused him to discharge his weapon on himself, leading to his death. Justin decides to investigate the matter. He receives a DVD of Kyle training Max; he later contacts a friend of Kyle, Sergeant Reyes, for help.
Later, Justin is approached by Chuy's other cousin Emilio (Joseph Julian Soria), a cartel member, who presses him over a video game bootleg. Afterwards, Justin and Max follow Emilio into the woods, where they secretly observe a meeting between cartel members and Tyler, who tries selling stolen weapons to them. The cartel's dogs sense Max and run after him. Max fights them off, severely wounding one of the dogs, while Justin runs away and leaves his bike behind. When he gets home, he finds Tyler and Stack, the cartel's dog handler, who was injured in the melee. Feigning innocence, they accuse Max of doing harm and demand his euthanization.
Max is taken by animal control officers but escapes. Meanwhile, Ray catches Tyler making a business deal with the cartel but is held hostage by Emilio. Max makes it home and leads Justin, Chuy, and Carmen into the woods to rescue Ray. Confronting the cartel, they incapacitate Emilio and the last cartel dog and rescue Ray. Tyler and Stack chase after Justin and Ray, but Stack is killed after crashing his off-road pickup truck. Tyler corners Justin at a damaged bridge and is threatening to shoot him and Max attacks Tyler and saves Justin's life. The two are knocked over the side of the bridge; while Tyler is killed by the fall, Max survives. Afterwards, Emilio is arrested and sent to jail.
The family welcomes Max into their home. After Justin and Max visit Kyle's grave, they invite Chuy and Carmen over for dinner.
",upload.wikimedia.org/wikipedia/en/thumb/d/d9/Max_poster.jpg/220px-Max_poster.jpg,2015,https://en.wikipedia.org//wiki/Max_(2015_film)
104,Ted 2,"Taking place sometime after the events of the first film, Ted marries his girlfriend, Tami-Lynn, six months after John Bennett and Lori Collins divorced. One year later, following a heated argument between Ted and Tami-Lynn, Ted's other co-worker, Joy, suggests they have a baby. As Ted cannot father a child, John agrees to help find a sperm donor. They ask Sam J. Jones but he declines due to a sperm count of one. Then they unsuccessfully try to break into Tom Brady's house and steal his sperm. John ultimately volunteers to donate his sperm, but Tami-Lynn is found to be infertile due to past drug use; subsequently, the couple decide to adopt. The background checks bring Ted's legal status as a person into question, and the state authorities of Massachusetts declare Ted to be property rather than a person. Consequently, he loses his job, his credit card and bank accounts are terminated and his marriage to Tami-Lynn is annulled.
John suggests that they take the state to court. They ask the best lawyer they can find, who assigns the case pro bono to his niece Samantha ""Sam"" Jackson, a novice lawyer. They are initially reluctant due to her lack of pop culture knowledge, but bond over their love of marijuana as they prepare to present the case. Meanwhile, Donny, Ted's life-long stalker, is now working as a janitor at Hasbro's headquarters in New York City. He proposes to the company CEO to abduct Ted for research in order to manufacture live teddy bears commercially, convincing him to hire an expert attorney to ensure that Ted maintains his status as property.
Despite Sam's best efforts, the court rules against Ted. Disheartened and desperate, the trio contact Patrick Meighan, a highly respected civil rights attorney, to help overturn the court's decision. Along a trip to Manhattan to meet with Meighan, John and Sam fall in love and eventually kiss. When the trio meet Meighan, he is sympathetic to Ted's plight but ultimately refuses the case, as he believes Ted has not significantly contributed to humanity due to his lifestyle.
Furious at the injustice and jealous of Sam and John's relationship, Ted takes his frustrations out on them and angrily storms off, wandering into the New York Comic-Con. Donny, disguised as a Raphael cosplayer, discreetly follows Ted inside. Ted steals another person’s phone and calls Sam and John to inform them of his situation, just as Donny abducts him. John and Sam arrive and find Ted, just as Donny is about to cut him open. Ted apologizes to John and Sam for snapping at them and make their leave, but Donny severs the cables holding up a display model of the Enterprise-D and it swings towards Ted. John pushes Ted out of the way to save him, takes the hit and is knocked unconscious before Donny is arrested.
John is rushed to the hospital, where he flatlines. The next day, the group is told that John has died and tearfully visit him, but John wakes up and scares the group, revealing the doctors revived him and they worked with him afterwards to prank them. Although Sam is initially furious, she and John kiss as the group rejoices. Meighan decides to take the case, inspired by John's selflessness and Ted's emotions over the injured John. Meighan successfully gets the ruling overturned by demonstrating that Ted is self-aware, that he feels complex emotions, and is capable of empathy. Ted and Tami-Lynn remarry and adopt a baby boy, naming him after Rocky character ""Apollo Creed"",  while John and Sam happily pursue their own relationship. John even gives Apollo Creed a teddy bear of his own.
In a post-credit scene, Liam Neeson, who previously bought a box of Trix cereal from Ted at the grocery store returns to the store, seemingly injured, and puts the cereal back on the counter and leaves with a look of betrayal.
",upload.wikimedia.org/wikipedia/en/thumb/3/3d/Ted_2_poster.png/220px-Ted_2_poster.png,2015,https://en.wikipedia.org//wiki/Ted_2
105,Terminator Genisys,"In 2029, Human Resistance leader John Connor launches a final offensive against Skynet, an artificial general intelligence system seeking to eliminate the human race. Before the Resistance can triumph, Skynet activates a time machine and sends a T-800/Model 101 Terminator back to 1984, to kill John's mother Sarah. John's right-hand man, Kyle Reese, volunteers to travel back in time to protect her. As Kyle floats in the machine's magnetic field, he sees John being attacked by another Resistance soldier. This creates a temporal paradox that alters the timeline and causes Kyle to experience childhood memories from a parallel version of himself.
When it arrives in Los Angeles 1984, Skynet's T-800 is disabled by Sarah and ""Pops"", a reprogrammed T-800. An unknown party had sent Pops to 1973 to protect Sarah when she was nine years old after her parents were killed by a T-1000 sent by Skynet. When Kyle arrives in 1984, he is intercepted by the T-1000, which Sarah and Pops destroy with acid. Sarah and Pops have constructed a makeshift time machine like Skynet's and Sarah plans to stop Skynet by traveling to 1997, the year it becomes self-aware. However, realizing that the past has been altered, Kyle is convinced that the future has also changed. He recalls a warning he received in his childhood vision, convincing Sarah that they instead must travel to 2017 to stop Skynet. After fighting the T-1000, Pops has sustained exterior damages that prevent him from time traveling. He stays in 1984 and plans to meet up with Kyle and Sarah in the future, preparing for their arrival in the meantime.
In 2017, Kyle and Sarah materialize in the middle of a busy San Francisco highway and are apprehended by city police. While they are treated for injuries, Sarah and Kyle learn that Skynet is called ""Genisys""—a soon-to-be-unveiled global operating system which is embraced by the public. John suddenly appears and rescues Sarah and Kyle. Pops arrives and unexpectedly shoots John, revealing that John is now an advanced Terminator.[a] The resistance soldier who attacked John is revealed to have been Skynet in physical disguise as a Terminator.[b] While Kyle was traveling back in time, Skynet attacked John and infected him with a nanotechnology that converted him into a machine on a cellular level. John, tasked with ensuring Skynet's creation, traveled back in time to assist Cyberdyne Systems with the development of Genisys, hence securing Skynet and its machines' rise. Pops fights John before trapping him long enough for them to escape.
A day before Skynet's worldwide attack, Sarah, Kyle, and Pops retreat to a safe house and make final preparations to destroy Cyberdyne's Genisys mainframe. They head toward Cyberdyne's headquarters with John in close pursuit. During an airborne chase, Pops dive-bombs into John's helicopter and causes it to crash. John survives the crash and enters the Cyberdyne complex, where it advances the countdown from 13 hours to 15 minutes. Kyle, Sarah, and Pops plant bombs at key points in the facility while holding off John.
In a final battle, Pops traps John in the magnetic field of a prototype time machine. Both are destroyed, but just before the explosion, Pops' remains are flung out of the apparatus into a nearby experimental vat of mimetic polyalloy. Kyle and Sarah reach a bunker beneath the facility and the explosion sets off the bombs, preventing Genisys from coming online. Pops appears, upgraded with mimetic polyalloy components like that of the T-1000, and helps them escape from the debris.
The trio travels to Kyle's childhood home, where Kyle tells his younger self about Genisys and instructs him to repeat the warning to himself, securing the trio's arrival from 1984. Sarah, Kyle, and Pops drive off into the countryside. A mid-credits scene reveals that the system core of Genisys, located in a protected subterranean chamber, has survived the explosion.[c]
",upload.wikimedia.org/wikipedia/en/thumb/b/bc/Terminator_Genisys.JPG/220px-Terminator_Genisys.JPG,2015,https://en.wikipedia.org//wiki/Terminator_Genisys
106,Magic Mike XXL,"Three years after quitting male stripping, Mike has his own furniture business. He receives a call from Tarzan who informs him that Dallas is ""gone"". Believing that his former boss has died, Mike goes to a hotel to find his friends, the remaining Kings of Tampa, at a pool party.
After revealing Dallas bailed on them to start a new show in Macau and only took ""The Kid""[c] with him, the Kings let Mike in on their plan: to end their careers on a high note at the Myrtle Beach male stripping convention. Later, while trying to work, Mike dances to a song he used to strip to. Reinvigorated, he decides to join them on their trip.
Driving in a fro-yo van owned by Tito and Tobias, they make their first stop at Mad Mary's. To prove to Richie he is willing to commit to the trip, Mike participates in an amateur drag queen contest, and the others join him shortly. They then go to a beach where Mike lets Ken hit him to resolve his issues with him. He also meets photographer Zoe who tells him that she is off to New York. They flirt but agree to not have sex.
Back on the road, Mike suggests that they change their routine after the group (except Tarzan) take MDMA. At a gas station, he coerces Richie into trying to make the cashier smile with an improvised striptease. This inspires the others to abandon their old routines.
Soon afterwards, Tobias falls asleep at the wheel, crashing the van. He suffers a concussion and needs hospitalization; everyone else is left unscathed. In the hospital, they begin to lose morale, and contemplate quitting and heading home. Mike then reveals that his furniture business is not going that well and that he is no longer with Brooke after she rejected his proposal. The group decides to continue on.
In search of a new MC, Mike brings the group to a Savannah strip club owned by Rome, a woman Mike has a history with. Despite proving that his skills have not deteriorated, he is unsuccessful in getting her to help them. However, she gets Andre, a rapper/singer who works at the club, to drive them to their next stop.
Arriving at a mansion, Tito tells them he knows the girl who lives there and she is expecting them. Walking in, they are greeted by her mother, Nancy, and her friends, all middle-aged women. Nancy's teasing initially makes them feel awkward, but as the night progresses, the mood lightens. Mike meets Zoe again, and she tells him about how another photographer, under the guise of needing an assistant, tried to have an extramarital affair with her. Mike urges her to regain her smile at the convention.
After sleeping with Richie, Nancy lets them drive her ex-husband's car to Myrtle Beach. Upon arrival, they are surprised to see Rome. She had a change of heart, agreeing to be their MC. Andre and Malik also came to help. With preparations complete, they head to the convention where they squeeze in a spot thanks to Rome and her history with the organizer of the event, Paris.
The group's performance is a success. During Mike and Malik's performance, Mike brings Zoe on stage. Tobias returns with the fro-yo van as everyone celebrates and watches the Fourth of July fireworks.
",upload.wikimedia.org/wikipedia/en/thumb/d/df/Magic_mike_xxl.jpg/220px-Magic_mike_xxl.jpg,2015,https://en.wikipedia.org//wiki/Magic_Mike_XXL
107,Minions (film),"Minions are small, yellow pill-shaped creatures which have existed since the beginning of time, evolving from single-celled organisms into beings which exist only to serve history's most evil masters, but they accidentally end up killing all their masters: rolling a Tyrannosaurus into a volcano, letting a caveman get mauled by a bear, crushing a Pharaoh and his subjects with a pyramid, and exposing Count Dracula to sunlight. They are driven into isolation after firing a cannon at Napoleon while in Russia and start a new life inside a cave, but after many years, the Minions become sad and unmotivated without a master to serve. This prompts three Minions; named Kevin, Stuart and Bob, to go out on a quest to find a new master for their brethren to follow.
The three journey in 1968 to New York City and stay at a department store for the night, where they come across a hidden commercial broadcast advertising Villain-Con, an Orlando convention for all villains. The next day, they hitchhike a ride with the Nelsons, a family of thieves. At the convention, they meet Scarlet Overkill, the world's first female supervillain, who unexpectedly hires them and takes them to her home in London. They phone the rest of the Minions to get them to join. Scarlet plans to steal the Imperial State Crown from Queen Elizabeth II, promising to reward the Minions if they succeed, but also threatening to kill them if they fail.
Scarlet's husband Herb supplies them with inventions to aid in the heist, but they are nearly caught while breaking into the Tower of London. During the subsequent chase, Bob runs into the Sword in the Stone and pulls the sword free to defend himself and his friends, removing the Queen from the throne and making Bob the new King. Enraged that someone else accomplished her dream of stealing the throne, Scarlet confronts Bob, who voluntarily abdicates the throne in her favor. Undeterred, Scarlet imprisons Kevin, Stuart and Bob in a dungeon, where Herb attempts to torture the trio, but they escape with the intention to apologize to Scarlet at her coronation.
After making their way to Westminster Abbey, Kevin, Stuart and Bob interrupt the coronation by inadvertently dropping a chandelier on Scarlet. Scarlet survives the falling fixture and, mistaking the accident for an assassination attempt, orders the trio's execution and has other villains chase them through the streets of London during a thunderstorm. Stuart and Bob are captured, while Kevin hides in a pub and sees Scarlet on television, who declares that she will kill Stuart and Bob if Kevin does not show up by dawn. With the villains still searching for him, Kevin sneaks into Scarlet's castle to steal weapons and triggers a machine Herb was building, causing him to grow in size into a giant. Kevin tramples through London, rescues his friends and battles Scarlet, just as the other Minions turn up in the city. Scarlet tries to eradicate them by firing a massive missile, but Kevin swallows it. Scarlet and Herb attempt to escape with her rocket dress, only for Kevin to hold onto it and get pulled into the sky. The missile explodes, seemingly killing Kevin, Scarlet and Herb. As the Minions mourn the loss of their leader, Kevin survives after returning to his normal size.
The Queen gets her throne and crown back. She rewards Bob with a tiny crown for his teddy bear Tim, Stuart with an electric guitar, and Kevin with a knighthood. Scarlet and Herb, still alive, steal the crown again, only to be stopped by a young Gru, who fires a freeze ray at them and flees with the crown on a rocket-powered motorcycle. The Minions run after him, deciding he is the master they were looking for.
",upload.wikimedia.org/wikipedia/en/1/19/Minions_%282015_film%29.jpg,2015,https://en.wikipedia.org//wiki/Minions_(film)
108,The Gallows,"On October 29, 1993, Beatrice High School student Charlie Grimille is accidentally hanged and killed after a prop malfunction during a presentation of the play The Gallows. His parents, along with the whole audience, witness the tragic event.
Twenty years later, on October 28, 2013, the school attempts to put on a new performance of The Gallows. Football jock Reese Houser auditions for the play, only because this will give him a chance to grow closer to his crush Pfeifer Ross, who will be in the play. Surprisingly, he gets the lead role, which is much more than he bargained for.  He needs a way out of the play, so his friend Ryan Shoos comes up with the idea to vandalize the set and sabotage the whole play. That night, Reese, Ryan, and Ryan's girlfriend, Cassidy Spilker, sneak into the school and begin to dismantle the set, only to hear Pfeifer in the hallway. They try to leave but find that they have been locked inside, and there is no cell phone reception. Disturbed, Cassidy admits the trio's real reason for being in the school at this time, which angers Pfeifer.
When they get back to the stage, the group sees that the set has suddenly reassembled. An old television switches on by itself, playing back a tape with the news coverage of Charlie's death, which includes an interview with his girlfriend Alexis. They discover that Charlie was not supposed to have performed that day, and was on stage only because he was the understudy for the main actor, who turns out to have been Reese's father, Rick. The group becomes separated. Alone, Ryan sees various things, such as a hidden room with a mattress and bed frame, and a body hanging. When the group is reunited, Cassidy is yanked into the air by seemingly nothing, leaving her with burns on her neck that look like rope burns.
They return to the stage, where Pfeifer points out an air conditioning duct they can escape through. Ryan is thrown off the ladder by an unseen force, and his leg is broken. The group becomes locked out of the stage where Ryan lies helpless. They eventually get back, finding only Ryan's phone. The audience then sees footage from the phone.
Ryan sees a figure holding a noose. He is then pulled away by the neck by a fly rig. As the night progresses, Cassidy is killed by Charlie dressed as the Hangman, a character from The Gallows. Reese and Pfeifer end up on the stage, where the spirit begins to choke her. Realizing Charlie wants them to act out the final scene (in which Reese and Charlie's characters are hanged), Reese and Pfeifer reenact the scene. However, when Reese puts the noose around his neck, he is hanged and killed by Charlie. Once he is dead, Pfeifer and Charlie, now appearing as an adult, both bow, and Alexis, who was watching the performance, gives a standing ovation.
The police enter the house where Pfeifer and Alexis are living and watching footage of Charlie's death, showing that Pfeifer is the daughter of Charlie and Alexis. When they attempt to question them about Charlie, Pfeifer warns, ""You shouldn’t say that name"". The officer witnesses his partner being dragged by a noose, killing him. Charlie then attacks and kills the policeman, as the screen cuts to black.
",upload.wikimedia.org/wikipedia/en/thumb/7/72/The_Gallows_Poster.jpg/220px-The_Gallows_Poster.jpg,2015,https://en.wikipedia.org//wiki/The_Gallows
