,Movie Title,Plot Summary,Cover Image,Year,Source
155,Bridge of Spies (film),"In 1957 New York City, Rudolf Abel is arrested and charged with spying for the Soviet Union, and insurance lawyer James B. Donovan is appointed to be Abel's legal counsel. Committed to the principle that the accused deserves a vigorous defense, he mounts the best defense of Abel he can, declining along the way to cooperate in the CIA's attempts to induce him to violate the confidentiality of his communications with his client.
Abel is convicted, but Donovan convinces the judge to spare Abel the death penalty because Abel had been serving his country honorably, and he might prove useful for a future prisoner exchange; Abel is sentenced to 30 years. Donovan appeals the conviction to the Supreme Court based on the lack of a search warrant for the seizure of Abel's ciphers and photography equipment. For his principled stand, Donovan and his family are harassed, including shots being fired at their home. The conviction is upheld in a very close margin.
In 1960, Gary Powers, a pilot in the CIA's top-secret U-2 spy plane program, is shot down over the USSR. He is captured and sentenced to ten years' confinement, including three years in prison.
Donovan receives a letter from East Germany, purportedly sent by Abel's wife, thanking him and urging him to get in contact with their lawyer, whose name is Vogel. The CIA thinks this is a back-channel message hinting that the USSR is willing to swap Powers for Abel. They unofficially ask Donovan to go to Berlin to negotiate the exchange; he arrives just as the Berlin Wall is going up. Crossing into East Berlin, he meets with a KGB officer in the Soviet Embassy and is then directed to Vogel, who represents the Attorney General of the German Democratic Republic (East Germany). The Attorney General seeks to swap Abel for an American graduate student named Frederic Pryor, who had been arrested in East Germany; in the process, the GDR hopes to gain official recognition by the United States.
The CIA wants Donovan to disregard Pryor but he insists that both Pryor and Powers be swapped for Abel. In a message to the Attorney General, he bluffs that they will either release Pryor with Powers or there will be no deal. The exchange of Powers and Abel is to take place at the Glienicke Bridge, with Pryor to be released simultaneously at Checkpoint Charlie. Tension builds as Pryor fails to arrive. The CIA, still primarily concerned with Powers, tell Abel he can go, but Abel, out of respect for Donovan's dedication to both his own case and securing Pryor's release, refuses to move. It is confirmed that Pryor has been released, and the exchange takes place.
The next day, back in the United States, the government publicly acknowledges Donovan for negotiating the deal, rehabilitating his public image.
",upload.wikimedia.org/wikipedia/en/thumb/f/fa/Bridge_of_Spies_poster.jpg/220px-Bridge_of_Spies_poster.jpg,2015,https://en.wikipedia.org//wiki/Bridge_of_Spies_(film)
156,Crimson Peak,"In 1887 Buffalo, New York, American heiress Edith Cushing, daughter of wealthy businessman Carter Cushing, is visited by her mother's ghost who warns, ""Beware of Crimson Peak.""
In 1901, Edith is now a budding author, and meets English baronet Sir Thomas Sharpe and his sister, Lucille. Thomas seeks investors for his invention, a digging machine to revive his family's clay mines, but Mr. Cushing rejects his proposal. Thomas and Edith become romantically attached, leading her father to hire a private detective who uncovers unsavory facts about the Sharpe siblings. Mr. Cushing bribes them to leave America, forcing Thomas to ""break Edith's heart"" by disparaging her and her novel.
Thomas returns Edith's manuscript with a letter explaining his actions, and they reconcile. Mr. Cushing is brutally murdered, raising the suspicions of Edith's childhood friend, Dr. Alan McMichael. Thomas marries Edith — giving her a ring taken from Lucille — and they arrive at Allerdale Hall, the Sharpes' dilapidated Cumberland mansion, which is sinking into the red clay mine below. Lucille plies Edith with tea made from ""firethorn berries"", and Thomas persuades her to put her father's fortune toward his machine. He mentions that the estate is referred to as ""Crimson Peak"" due to the warm red clay seeping through the winter snow.
Edith begins to notice Thomas' absence from their shared bedroom during the night. She eventually grows weak and begins coughing up blood, plagued by nightmares and visited by gruesome red ghosts around Allerdale. One of the spirits tricks her into opening a closet, where she discovers wax phonograph cylinders, before chasing her into the cellars, where she finds a locked trunk engraved with the name ""Enola"". Thomas takes Edith on a trip to the local post office, where she receives a letter addressed to E. Sharpe. Snowed in for the night, they finally make love, which Lucille is infuriated to learn.
Edith steals a key from Lucille bearing the inscription ""Enola"" and unlocks the trunk to find a gramophone and secret documents. Using the gramophone to listen to the audio recordings on the wax cylinders, and while reading the paper documents, Edith learns that Thomas previously married three other wealthy women — including Enola Sciotti, the letter’s intended recipient — and that Lucille has been poisoning Edith with tea as part of the siblings' ""marriage and murder"" scheme to finance Thomas' inventions. Edith confronts her husband and sister-in-law, catching them in an incestuous embrace, and Lucille pushes her from a balcony.
Alan has learned what Mr. Cushing uncovered about the Sharpes: Thomas's multiple marriages and Lucille's time in a mental institution. He travels to Allerdale Hall to rescue Edith, arriving just after she has been pushed. Tending to her injuries, Alan prepares to leave with Edith, but Lucille stabs him and demands that Thomas finish the job. Thomas, instead, inflicts a nonfatal stab wound to Alan before hiding him in the cellar.
Lucille forces Edith to sign a transfer deed granting the Sharpes ownership of her estate, and confesses to having murdered Thomas’ previous wives and having borne a child with Thomas that soon died — these are the ghosts who have appeared to Edith. Lucille admits to murdering Edith's father, as well as her own mother when she discovered Lucille and Thomas' sexual relationship. Edith stabs Lucille with her pen and flees, but is confronted by Thomas, who has truly fallen in love with her. He burns the deed and begs his sister to join him and Edith in a new life together, but an enraged Lucille stabs him to death. She pursues Edith with the cleaver she used to kill her mother, but is halted by Thomas' ghost, allowing Edith to kill her with a shovel. Edith silently bids Thomas farewell before he vanishes.
Edith and Alan are rescued by the villagers, and Lucille becomes the ghost of Allerdale Hall, playing her piano for eternity.
The end credits imply that Edith has written a novel based on her experiences, titled Crimson Peak.
",upload.wikimedia.org/wikipedia/en/a/ad/Crimson_Peak_theatrical_poster.jpg,2015,https://en.wikipedia.org//wiki/Crimson_Peak
157,Goosebumps (film),"After his father's death, teenage Zach Cooper and his mother Gale move from New York City to Madison, Delaware, where Gale has gotten a new job as the vice-principal of its local high school. Setting in the neighborhood, Zach meets his neighbor Hannah, whose overprotective father tells him to stay away from her. Zach also befriends a cowardly but friendly student named Champ during his first day at the school. Hannah invites Zach to an abandoned amusement park where they get know each other. Upon returning home, Hannah's father again warns him to stay away from them.
That same night, Gale has to supervise a school dance and leaves Zach with his aunt, Lorraine. Fearing Hannah is in danger, Zach tricks her father into going to the police station while he and Champ enter his house. They find a bookshelf with numerous locked manuscripts that catalog entires from the Goosebumps series. In response to Champ's curiosity about them, Zach unlocks the one cataloging The Abominable Snowman of Pasadena and the story's titular character emerges from it. With Hannah's help, they track the monster to an ice rink where Hannah's father appears and reimprisons it in the manuscript.
Hannah's father reveals himself as R. L. Stine, the creator of the Goosebumps franchise; he originally wrote the stories to cope with severe bullying but his creations became real as result of his overactive imagination and he was forced to keep them imprisoned in their manuscripts. Back at Stine's house, the quartet encounter Slappy the Dummy from the Night of the Living Dummy series, now freed from his manuscript. Seeking revenge on Stine for his imprisonment, Slappy incinerates his book, which leaves no other way to reimprison him and his brethren, and escapes with the others. The quartet are then attacked by the titular garden gnomes of Revenge of the Lawn Gnomes as they attempt to escape from the house.
Slappy releases several of his fellow monsters, causing havoc around Madison. Meanwhile, Lorraine is attacked by the vampiric poodle Fifi from Please Don't Feed the Vampire!. Zach convinces Stine to recapture the monsters by writing a single manuscript, but it can only be done using his supernatural typewriter currently on display at the school. En route, the quartet is attacked by Brent Green from My Best Friend is Invisible and the giant mantis from A Shocker on Shock Street,, forcing them to seek refuge in the local supermarket. Will Blake from The Werewolf of Fever Swamp chases and corners them in its parking lot where he is run over by Lorraine, who narrowly escaped from Fifi.
The quartet cut through a cemetery, during which Zach sees Hannah becoming ghost-like in the moonlight before they are attacked by the titular characters of Attack of the Graveyard Ghouls. At the school, Stine confesses to Zach that his daughter is Hannah Fairchild from The Ghost Next Door, whom he originally created to cope with his loneliness. They find the typewriter and Stine starts writing a story based on the events around them while Zach and Champ attempt to warn everyone, but nobody believes them until the mantis attacks the building.
Slappy releases the rest of the monsters and commands them to attack the school. Despite the best efforts of the school's staff and student body of keeping the monsters out, they break in nonetheless. Slappy finds Stine and breaks his fingers with the typewriter's case before he can finish the story. To ensure everyone's safety, the quartet trick the monsters into following a school bus rigged with explosives while they board another and drive to the abandoned amusement park. Realizing the ruse, Slappy tracks them down and releases the titular monster from The Blob That Ate Everyone as the other monsters arrive. Stine confronts it and is devoured while Zach, Hannah, and Champ take refuge in the park's ferris wheel where Zach finishes the story before the mantis causes the structure to collapse and roll down the hill. After surviving the ordeal, Zach refuses to open the story's manuscript because Hannah will also be sucked in, but Hannah reveals she knew the truth about herself all along and opens it, sucking all the monsters and herself inside as she bid farewell to Zach before accepting her fate.
Some time later, Stine begins working as a teacher at the school while starting a relationship with Lorraine. After class, he reveals to Zach that he brought Hannah back into reality by writing a new copy of her book. As Zach and Hannah leave together, Stine incinerates the copy but then finds his typewriter writing by itself. To his horror, Brent Green is revealed to have been omitted in his fellow monsters' reimprisonment and is using the typewriter to write a new Goosebumps story titled The Invisible Boy's Revenge.
",upload.wikimedia.org/wikipedia/en/thumb/2/2e/Goosebumps_%28film%29_poster.jpg/220px-Goosebumps_%28film%29_poster.jpg,2015,https://en.wikipedia.org//wiki/Goosebumps_(film)
158,Room (2015 film),"In Akron, Ohio, 24-year-old Joy Newsome and her five-year-old son Jack live in a squalid shed they call ""Room."" They share a bed, toilet, bathtub, television, and rudimentary kitchen; the only window is a skylight. They are captives of a man they call ""Old Nick,"" Jack's biological father, who abducted Joy seven years prior and routinely rapes her while Jack sleeps in the closet. Jack is the product of one rape. She tries to stay optimistic for her son but suffers from malnutrition and depression. She allows Jack to believe that only Room and its contents are real, and that the rest of the world exists only on television.
Old Nick tells Joy that he has lost his job and may not be able to afford their supplies in the future. That night, Jack is overcome with curiosity and ventures out of the closet while Old Nick is asleep in bed with his mother. Joy is horrified when she awakens and sees their interaction, slapping Old Nick away. As punishment, he cuts their heat and power. Joy decides to tell Jack about the outside world; he reacts with disbelief and incomprehension, but also curiosity. She has Jack fake a fever, hoping that Old Nick will take him to a hospital where he can alert the authorities, but Old Nick says he will return the following day with antibiotics.
Joy plans to help Jack escape Room by telling Old Nick that Jack has died from his illness. She wraps Jack in a rug and has him play dead, telling him to run to the first person he sees for help. Falling for the ruse, Old Nick places Jack in the back of his pickup truck and drives through a residential neighborhood. Although stunned by his first exposure to the outside world, Jack jumps from the truck and attracts the attention of a passerby. Old Nick attempts to drag Jack back to his truck, but fails in the process. He drops Jack and flees the scene. The police arrive and rescue Jack. The police discover Joy as well, and take her and Jack to a hospital. Old Nick is captured and arrested.
Reunited with her family, Joy learns that her parents have divorced and that her mother has a new partner, Leo. She returns with Jack to her childhood home where her mother and Leo live. Her father cannot accept Jack as his grandchild and leaves. Jack struggles to adjust to life in the larger world, speaking only to his mother and expressing a desire to return to Room. Joy struggles with anger and depression, lashing out at her mother and becoming worried about Jack's lack of interaction with ""real"" things.
At the suggestion of the family's lawyer as a way to earn money, Joy agrees to a television interview but becomes upset when the interviewer questions her decision to keep the newborn Jack instead of asking her captor to take him to a hospital so he could have a chance at a normal life. Overwhelmed, she subsequently attempts suicide after which Jack finds her unconscious in the bathroom, and she is admitted to a hospital.
Jack misses his mother but begins to settle into his new life. He bonds with his new family, meets Leo's dog, Seamus, and makes friends with a boy his age. Believing his long hair will give Joy the strength she needs to recover, Jack has his grandmother cut it for him so he can send it to her. Joy returns home and apologizes for her suicide attempt, thanking Jack for saving her life again. Joy and Jack begin to embrace life and do many activities that they enjoy. At Jack's request, they visit Room one last time, escorted by police. Jack is confused; he feels it has shrunk and that it is a different place with the door open. He and Joy say their goodbyes to Room and leave.
",upload.wikimedia.org/wikipedia/en/thumb/c/c2/Room_%282015_film%29.png/220px-Room_%282015_film%29.png,2015,https://en.wikipedia.org//wiki/Room_(2015_film)
159,Woodlawn (film),"Miami Dolphins superstar running back Tony Nathan attended Woodlawn High School in Birmingham, Alabama during the early 1970s. Nathan became a model student and the first black football superstar in Alabama history. He and other black students played on the mainly white team under coach Tandy Gerelds at a time when racial tensions were very high. He was credited with helping to unify the team, which went on to play the biggest high school game in Alabama history. After high school Nathan played for Coach Paul ""Bear"" Bryant at the University of Alabama. He later played under coach Don Shula with the Miami Dolphins and was a starter in two Super Bowls. The 2015 film Woodlawn starring Caleb Castille as Nathan and Nic Bishop as Coach Gerelds, with Jon Voight as Bear Bryant is based on his high school years.
When Woodlawn High School in Birmingham, Alabama, is controversially desegregated in 1973, gifted black athlete Tony Nathan and several other black players join the school's predominantly white football team. The coach, Tandy Gerelds, tells the team to use their shared anger at repeated violent incidents to unite them, but black and white players clash on and off the field. After a riot at the school, Gerelds lets traveling sports chaplain Hank Erwin speak to the team as a ""motivational speaker"". Hank's speech moves nearly the entire team to accept Hank's invitation to commit their lives to follow Jesus Christ, and to join in prayer and work. Gerelds does not accept the invitation, and is unsure what to make of the event.
The team loses its first game, but after Gerelds decides to play Nathan over the objections of some of the white players' parents, they win their next game. Nathan becomes a breakout star, and the team goes on a long winning streak leading up to their final game with rival L. Frazier Banks High School.[7]
Banks coach ""Shorty"" White instructs his players to target Nathan, and the repeated hard tackles take their toll. Nathan scores a touchdown, but is injured by a vicious late hit and is unable to continue playing. Woodlawn loses, but Gerelds expresses pride in his team for ""the men they've become"". After coming to faith Gerelds eventually seeks out Nathan's church during a Sunday service, where he testifies to the change in his life, and asks to be baptized.
Many people wonder about the turnaround in Woodlawn's team, and Hank arranges a meeting between the Woodlawn players and Banks players, leading to a spiritual awakening on the Banks team as well. Gerelds and White hold an unprecedented joint football camp before the 1974 season, and a camaraderie develops between the two teams. Both go undefeated for the season until their final game against each other, which because of the stardom of Nathan and Banks quarterback Jeff Rutledge, draws a huge record crowd.
A few years later, now working as an insurance agent, Gerelds admits to a customer that while they did lose that big game, the transformation he witnessed in the lives of many people was miraculous.
After Nathan, now playing for Alabama, carries his team to victory in the 1979 Sugar Bowl, he calls Gerelds at home and expresses his gratitude, encouraging him to return to coaching.
",upload.wikimedia.org/wikipedia/en/thumb/f/f8/WoodlawnMoviePoster.jpg/220px-WoodlawnMoviePoster.jpg,2015,https://en.wikipedia.org//wiki/Woodlawn_(film)
160,Truth (2015 film),"In the months before the US 2004 presidential election, Mary Mapes (producer of the primetime news program 60 Minutes Wednesday) and her crew consisting of Mike Smith (Grace), Lucy Scott (Moss), and Colonel Roger Charles (Quaid) are seeking evidence to verify whether or not George W. Bush received any preferential treatment during his time in the military. Charles, knowing that the military ""is good at what they do,"" believes there were no mistakes or errors, despite some claims that Bush's records were lost or altered, and that Bush had difficulty meeting minimal physical aptitude testing. Seeking leads, Mapes and her crew eventually find Bill Burkett, who says he has documents in the form of memos and letters dictating that Bush did indeed have preferential treatment and went AWOL for one year in 1972. Rather also interviews former Texan Lieutenant Governor Ben Barnes who admits he pulled strings which enabled George Bush to join the National Guard. Mapes produces a story that Dan Rather reports on 60 Minutes.
After the airing, Mapes and Rather face questions over the accuracy of the segment. The authenticity of the documents on which the allegations are based is called into question. A controversy is fueled by radio hosts and bloggers and amplified by mainstream media sources, The Washington Post, and by CBS itself. Certain characteristics of the memos, such as their font and letter spacing, indicate they were created on a computer using Microsoft Word, and therefore could not have been typed on a typewriter in the early 1970s.[5] Subsequently, Burkett, who presented the documents, admits that he lied about where he obtained them.[6]
Jerry Killian was George W. Bush's commanding officer in 1972. At the time of the CBS reporting in 2004, Killian was dead. Killian's supervisory officer Robert ""Bobby"" Hodges recants an earlier statement that the Killian documents were authentic. However, Hodges refuses to dwell on whether or not there is ""truth"" in the documents.
Dan Rather is forced to apologize for presenting the material as fact. After the scandal, Mapes, her crew, and Rather are faced with charges that Mapes's liberal political agenda played a part in airing the segment. One by one they are forced to face an internal review panel to determine if political bias was a factor. The internal investigation focus on the authenticity of the Killian documents as opposed to their content. Smith, Scott and Charles are eventually banned from their work and fired, with Smith going on a rant in the office before being escorted out. Rather decides that after the hearing he will retire from broadcasting. After two sessions facing the board, Mapes lectures her opponents:
Nonetheless, she is fired after the hearing. Rather makes his last broadcast, citing the courage it took for his crew to get through the toughest times. 
Titles at the end of the film note that Mary Mapes was fired and four executives were asked to resign, and also that CBS won a Peabody Award for Mapes' earlier documentary exposing atrocities at Abu Ghraib.
",upload.wikimedia.org/wikipedia/en/thumb/5/51/Truth_2015_poster.jpg/220px-Truth_2015_poster.jpg,2015,https://en.wikipedia.org//wiki/Truth_(2015_film)
161,Experimenter (film),"The film is based on the true story of famed social psychologist Stanley Milgram, who in 1961 conducted a series of radical behavior experiments at Yale University that tested the willingness of ordinary humans to obey an authority figure while administering electric shocks to strangers. In the first half of the film, it is shown how the experiments are conducted, with nearly every test subject succumbing to the pressure of the circumstances and administering shocks to a stranger, despite the stranger begging him to stop. Between the experiments, it is shown how Milgram meets Alexandra (or Sasha), who will become his wife and mother of two children.
The second half of the film shows how Milgram struggles with the public outcry about the ethics of the experiments and how his career advances as he becomes a professor in New York City and continues to study social interactions and social pressure in more benign experimental settings, including the small-world experiment, the lost-letter experiment, the street-corner (or gawking) experiment, the familiar stranger experiment, and various experiments that he makes his students carry out.
Archive footage occurs frequently, either as recordings that Milgram watches or as a backdrop for entire scenes. Milgram's work continues until he dies from a heart attack at the age of 51. In the final scene, the street-corner experiment is repeated in the present day, with a cameo of the real-life Sasha Milgram. In a mid-credits scene, more archival footage is shown.
",upload.wikimedia.org/wikipedia/en/thumb/f/f3/Experimenter_Poster.jpg/220px-Experimenter_Poster.jpg,2015,https://en.wikipedia.org//wiki/Experimenter_(film)
162,Rock the Kasbah (film),"Richie Lanz, a has-been rock manager, takes his last remaining client on a USO tour of Afghanistan. When Richie finds himself in Kabul, abandoned, penniless and without his U.S. passport, he discovers a young Afghan girl named Salima with an extraordinary voice and manages to convince Producer of Afghan Star Daoud to put her through Afghanistan's version of American Idol.
The story is very freely adapted from the 2009 documentary Afghan Star, and was dedicated to one of the stars of that film, Setara Hussainzada.
",upload.wikimedia.org/wikipedia/en/thumb/7/78/Rock_the_Kasbah.jpg/220px-Rock_the_Kasbah.jpg,2015,https://en.wikipedia.org//wiki/Rock_the_Kasbah_(film)
